<?xml version="1.0" encoding="utf-8"?>
<Extensions xmlns="https://www.alibaba.com/water3"
            xmlns:xsi="http://www.w3.org/2001/XMLSchema-instance"
            xsi:schemaLocation="https://www.alibaba.com/water3  https://www.alibaba.com/water3.xsd">

    <Extension class="java.util.function.Function" base="baseFunction" desc="测试扩展能力1">
        <Business code="yhb, xxx" type="bean" desc="验货宝">
            <bean name="com.alibaba.water3.function.YhbFunction#0" lazy="true"/>
        </Business>
        <Business code="6, 8" type="bean" desc="验货宝" priority="0">
            <bean name="com.alibaba.water3.function.YhbFunction#0" lazy="true"/>
        </Business>
    </Extension>

    <Extension class="java.util.function.Supplier" base="baseSupplier" desc="测试扩展能力2">
        <Business code="yhb" type="hsf" desc="验货宝">
            <hsf service="xxx" group="xxx" version="xxx.yhb" lazy="true"/>
        </Business>

        <Business code="y**" type="bean" desc="验货宝">
            <bean name="com.alibaba.water3.function.YhbSupplier#0"/>
        </Business>
    </Extension>

    <Extension class="com.alibaba.water3.spi.ExtSpi" base="com.alibaba.water3.impl.ImplSpi" desc="测试扩展能力3">
        <Business code="yhb" type="hsf" desc="验货宝">
            <hsf service="xxx" group="xxx" version="xxx.yhb" lazy="true"/>
        </Business>
    </Extension>

</Extensions>